{
  "schema_version": 1,
  "coverage_policy": {
    "behavioral_percent": 91,
    "critical_lifecycles": [
      "source",
      "jobs",
      "destructive"
    ]
  },
  "operations": [
    {
      "id": "cli:watch create",
      "inventory": "cli",
      "classification": "behavioral_e2e",
      "reason": "Planned for behavioral coverage through a shared E2E adapter."
    },
    {
      "id": "cli:watch list",
      "inventory": "cli",
      "classification": "behavioral_e2e",
      "reason": "Planned for behavioral coverage through a shared E2E adapter."
    },
    {
      "id": "cli:watch get",
      "inventory": "cli",
      "classification": "behavioral_e2e",
      "reason": "Planned for behavioral coverage through a shared E2E adapter."
    },
    {
      "id": "cli:watch status",
      "inventory": "cli",
      "classification": "behavioral_e2e",
      "reason": "Planned for behavioral coverage through a shared E2E adapter."
    },
    {
      "id": "cli:watch update",
      "inventory": "cli",
      "classification": "behavioral_e2e",
      "reason": "Planned for behavioral coverage through a shared E2E adapter."
    },
    {
      "id": "cli:watch exec",
      "inventory": "cli",
      "classification": "behavioral_e2e",
      "reason": "Planned for behavioral coverage through a shared E2E adapter."
    },
    {
      "id": "cli:watch pause",
      "inventory": "cli",
      "classification": "behavioral_e2e",
      "reason": "Planned for behavioral coverage through a shared E2E adapter."
    },
    {
      "id": "cli:watch resume",
      "inventory": "cli",
      "classification": "behavioral_e2e",
      "reason": "Planned for behavioral coverage through a shared E2E adapter."
    },
    {
      "id": "cli:watch delete",
      "inventory": "cli",
      "classification": "behavioral_e2e",
      "reason": "Planned for behavioral coverage through a shared E2E adapter."
    },
    {
      "id": "cli:watch history",
      "inventory": "cli",
      "classification": "behavioral_e2e",
      "reason": "Planned for behavioral coverage through a shared E2E adapter."
    },
    {
      "id": "cli:monitor jobs",
      "inventory": "cli",
      "classification": "behavioral_e2e",
      "reason": "Planned for behavioral coverage through a shared E2E adapter."
    },
    {
      "id": "cli:map",
      "inventory": "cli",
      "classification": "behavioral_e2e",
      "reason": "Planned for behavioral coverage through a shared E2E adapter."
    },
    {
      "id": "cli:endpoints",
      "inventory": "cli",
      "classification": "behavioral_e2e",
      "reason": "Planned for behavioral coverage through a shared E2E adapter."
    },
    {
      "id": "cli:extract",
      "inventory": "cli",
      "classification": "behavioral_e2e",
      "reason": "Planned for behavioral coverage through a shared E2E adapter."
    },
    {
      "id": "cli:extract status",
      "inventory": "cli",
      "classification": "behavioral_e2e",
      "reason": "Planned for behavioral coverage through a shared E2E adapter."
    },
    {
      "id": "cli:extract cancel",
      "inventory": "cli",
      "classification": "behavioral_e2e",
      "reason": "Planned for behavioral coverage through a shared E2E adapter."
    },
    {
      "id": "cli:extract errors",
      "inventory": "cli",
      "classification": "behavioral_e2e",
      "reason": "Planned for behavioral coverage through a shared E2E adapter."
    },
    {
      "id": "cli:extract list",
      "inventory": "cli",
      "classification": "behavioral_e2e",
      "reason": "Planned for behavioral coverage through a shared E2E adapter."
    },
    {
      "id": "cli:extract cleanup",
      "inventory": "cli",
      "classification": "behavioral_e2e",
      "reason": "Planned for behavioral coverage through a shared E2E adapter."
    },
    {
      "id": "cli:extract clear",
      "inventory": "cli",
      "classification": "behavioral_e2e",
      "reason": "Planned for behavioral coverage through a shared E2E adapter."
    },
    {
      "id": "cli:extract worker",
      "inventory": "cli",
      "classification": "behavioral_e2e",
      "reason": "Planned for behavioral coverage through a shared E2E adapter."
    },
    {
      "id": "cli:extract recover",
      "inventory": "cli",
      "classification": "behavioral_e2e",
      "reason": "Planned for behavioral coverage through a shared E2E adapter."
    },
    {
      "id": "cli:search",
      "inventory": "cli",
      "classification": "behavioral_e2e",
      "reason": "Planned for behavioral coverage through a shared E2E adapter."
    },
    {
      "id": "cli:research",
      "inventory": "cli",
      "classification": "behavioral_e2e",
      "reason": "Planned for behavioral coverage through a shared E2E adapter."
    },
    {
      "id": "cli:scrape",
      "inventory": "cli",
      "classification": "behavioral_e2e",
      "reason": "Planned for behavioral coverage through a shared E2E adapter."
    },
    {
      "id": "cli:crawl",
      "inventory": "cli",
      "classification": "behavioral_e2e",
      "reason": "Planned for behavioral coverage through a shared E2E adapter."
    },
    {
      "id": "cli:embed",
      "inventory": "cli",
      "classification": "behavioral_e2e",
      "reason": "Planned for behavioral coverage through a shared E2E adapter."
    },
    {
      "id": "cli:ingest",
      "inventory": "cli",
      "classification": "behavioral_e2e",
      "reason": "Planned for behavioral coverage through a shared E2E adapter."
    },
    {
      "id": "cli:code-search",
      "inventory": "cli",
      "classification": "behavioral_e2e",
      "reason": "Planned for behavioral coverage through a shared E2E adapter."
    },
    {
      "id": "cli:brand",
      "inventory": "cli",
      "classification": "behavioral_e2e",
      "reason": "Planned for behavioral coverage through a shared E2E adapter."
    },
    {
      "id": "cli:debug",
      "inventory": "cli",
      "classification": "behavioral_e2e",
      "reason": "Planned for behavioral coverage through a shared E2E adapter."
    },
    {
      "id": "cli:diff",
      "inventory": "cli",
      "classification": "behavioral_e2e",
      "reason": "Planned for behavioral coverage through a shared E2E adapter."
    },
    {
      "id": "cli:doctor",
      "inventory": "cli",
      "classification": "behavioral_e2e",
      "reason": "Planned for behavioral coverage through a shared E2E adapter."
    },
    {
      "id": "cli:doctor diagnose",
      "inventory": "cli",
      "classification": "behavioral_e2e",
      "reason": "Planned for behavioral coverage through a shared E2E adapter."
    },
    {
      "id": "cli:query",
      "inventory": "cli",
      "classification": "behavioral_e2e",
      "reason": "Planned for behavioral coverage through a shared E2E adapter."
    },
    {
      "id": "cli:retrieve",
      "inventory": "cli",
      "classification": "behavioral_e2e",
      "reason": "Planned for behavioral coverage through a shared E2E adapter."
    },
    {
      "id": "cli:ask",
      "inventory": "cli",
      "classification": "behavioral_e2e",
      "reason": "Planned for behavioral coverage through a shared E2E adapter."
    },
    {
      "id": "cli:summarize",
      "inventory": "cli",
      "classification": "behavioral_e2e",
      "reason": "Planned for behavioral coverage through a shared E2E adapter."
    },
    {
      "id": "cli:evaluate",
      "inventory": "cli",
      "classification": "behavioral_e2e",
      "reason": "Planned for behavioral coverage through a shared E2E adapter."
    },
    {
      "id": "cli:train",
      "inventory": "cli",
      "classification": "behavioral_e2e",
      "reason": "Planned for behavioral coverage through a shared E2E adapter."
    },
    {
      "id": "cli:suggest",
      "inventory": "cli",
      "classification": "behavioral_e2e",
      "reason": "Planned for behavioral coverage through a shared E2E adapter."
    },
    {
      "id": "cli:sources",
      "inventory": "cli",
      "classification": "behavioral_e2e",
      "reason": "Planned for behavioral coverage through a shared E2E adapter."
    },
    {
      "id": "cli:domains",
      "inventory": "cli",
      "classification": "behavioral_e2e",
      "reason": "Planned for behavioral coverage through a shared E2E adapter."
    },
    {
      "id": "cli:stats",
      "inventory": "cli",
      "classification": "behavioral_e2e",
      "reason": "Planned for behavioral coverage through a shared E2E adapter."
    },
    {
      "id": "cli:status",
      "inventory": "cli",
      "classification": "behavioral_e2e",
      "reason": "Planned for behavioral coverage through a shared E2E adapter."
    },
    {
      "id": "cli:jobs list",
      "inventory": "cli",
      "classification": "behavioral_e2e",
      "reason": "Planned for behavioral coverage through a shared E2E adapter."
    },
    {
      "id": "cli:jobs get",
      "inventory": "cli",
      "classification": "behavioral_e2e",
      "reason": "Planned for behavioral coverage through a shared E2E adapter."
    },
    {
      "id": "cli:jobs events",
      "inventory": "cli",
      "classification": "behavioral_e2e",
      "reason": "Planned for behavioral coverage through a shared E2E adapter."
    },
    {
      "id": "cli:jobs stream",
      "inventory": "cli",
      "classification": "behavioral_e2e",
      "reason": "Planned for behavioral coverage through a shared E2E adapter."
    },
    {
      "id": "cli:jobs cancel",
      "inventory": "cli",
      "classification": "behavioral_e2e",
      "reason": "Planned for behavioral coverage through a shared E2E adapter."
    },
    {
      "id": "cli:jobs retry",
      "inventory": "cli",
      "classification": "behavioral_e2e",
      "reason": "Planned for behavioral coverage through a shared E2E adapter."
    },
    {
      "id": "cli:jobs recover",
      "inventory": "cli",
      "classification": "behavioral_e2e",